Film_title,Release_year,Director,Cast,Average_rating,Owner_rating,Genres,Runtime,Countries,Original_language,Spoken_languages,Description,Studios,Watches,List_appearances,Likes,Fans,½,★,★½,★★,★★½,★★★,★★★½,★★★★,★★★★½,★★★★★,Total_ratings,Film_URL
The Wild Robot,2024,Chris Sanders,"[""Lupita Nyong'o"", 'Pedro Pascal', 'Kit Connor', 'Bill Nighy', 'Stephanie Hsu', 'Matt Berry', 'Ving Rhames', 'Mark Hamill', ""Catherine O'Hara"", 'Boone Storm', 'Alexandra Novelle', 'Raphael Alejandro', 'Paul-Mikél Williams', 'Eddie Park', 'Dee Bradley Baker', 'Randy Thom', 'Avrielle Corti', 'Keston John', 'Max Mittelman', 'Piotr Michael', 'Alessandro Beghi', 'Tiago Martinez', 'Becca Last', 'Madelyn Turpin', 'Kayleigh Rayne', 'Isabelle Tupin', 'Beckett Blomberg', 'Damon Fung', 'King Moore', 'Collin Erker']",4.26,4.5,"['Family', 'Science Fiction', 'Animation']",102,['USA'],English,['English'],"After a shipwreck, an intelligent robot called Roz is stranded on an uninhabited island. To survive the harsh environment, Roz bonds with the island's animals and cares for an orphaned baby goose.",['DreamWorks Animation'],432864,92149,208751,4400,195,471,530,2316,4311,19574,40066,108840,88211,128220,392734,https://letterboxd.com/film/the-wild-robot/
Alien: Romulus,2024,Fede Álvarez,"['Cailee Spaeny', 'David Jonsson', 'Archie Renaux', 'Isabela Merced', 'Spike Fearn', 'Aileen Wu', 'Rosie Ede', 'Soma Simon', 'Bence Okeke', 'Viktor Orizu', 'Robert Bobroczkyi', 'Trevor Newlin', 'Annemarie Griggs', 'Daniel Betts']",3.64,4.0,"['Science Fiction', 'Horror']",119,['USA'],English,['English'],"While scavenging the deep ends of a derelict space station, a group of young space colonizers come face to face with the most terrifying life form in the universe.","['20th Century Studios', 'Scott Free Productions', 'Brandywine Productions']",738113,158512,260407,2300,1602,3865,4587,18922,30721,99458,151283,223521,70667,54714,659340,https://letterboxd.com/film/alien-romulus/
Deadpool & Wolverine,2024,Shawn Levy,"['Ryan Reynolds', 'Hugh Jackman', 'Emma Corrin', 'Matthew Macfadyen', 'Dafne Keen', 'Jon Favreau', 'Morena Baccarin', 'Rob Delaney', 'Leslie Uggams', 'Jennifer Garner', 'Wesley Snipes', 'Channing Tatum', 'Chris Evans', 'Henry Cavill', 'Wunmi Mosaku', 'Aaron Stanford', 'Tyler Mane', 'Karan Soni', 'Brianna Hildebrand', 'Shioli Kutsuna', 'Stefan Kapičić', 'Randal Reeder', 'Lewis Tan', 'Nick Pauley', 'Sonita Henry', 'Ryan McKen', 'Nanak Phlora', 'Aydin Ahmed', 'Leemore Marrett Jr.', 'James Dryden', 'Ollie Palmer', 'Greg Hemphill', 'Aaron W Reed', 'Mike Waters', 'Rob McElhenney', 'James Reynolds', 'Ed Kear', 'Paul G. Raymond', 'Blake Lively', 'Inez Reynolds', 'Nathan Fillion', 'Matthew McConaughey', 'OIin Reynolds', 'Paul Mullin', 'Alex Kyshkovych', 'Chris Hemsworth', 'Billy Clements', 'Daniel Medina Ramos', 'Jade Lye', 'Nilly Cetin', 'Eduardo Gago Muñoz', 'Chloe Kibble', 'Curtis Rowland Small', 'Ayesha Hussain', 'Jessica Walker', 'Harry Holland', 'Kevin Fortin']",3.56,3.0,"['Science Fiction', 'Action', 'Comedy']",128,['USA'],English,['English'],"A listless Wade Wilson toils away in civilian life with his days as the morally flexible mercenary, Deadpool, behind him. But when his homeworld faces an existential threat, Wade must reluctantly suit-up again with an even more reluctant Wolverine.","['Marvel Studios', 'Maximum Effort', '21 Laps Entertainment', '20th Century Studios', 'Kevin Feige Productions', 'TSG Entertainment']",1550530,243381,551804,6000,7962,16006,17152,54735,78358,213879,251836,366990,140118,211604,1358640,https://letterboxd.com/film/deadpool-wolverine/
A Quiet Place: Day One,2024,Michael Sarnoski,"[""Lupita Nyong'o"", 'Joseph Quinn', 'Alex Wolff', 'Djimon Hounsou', 'Eliane Umuhire', 'Takunda Khumalo', 'Alfie Todd', 'Avy-Berry Worrall', 'Ronnie Le Drew', 'Benjamin Wong', 'Michael Roberts', 'Gavin Fleming', 'Elijah Ungvary', 'Alexander John', 'Thara Schöön', 'Thea Butler', 'Choy-Ling Man']",3.19,3.0,"['Thriller', 'Science Fiction', 'Horror']",99,['USA'],English,['English'],"As New York City is invaded by alien creatures who hunt by sound, a woman named Sam fights to survive with her cat.","['Paramount Pictures', 'Platinum Dunes', 'Sunday Night Productions']",607418,106284,151957,419,2670,7385,8197,34765,50627,135157,125468,115227,25454,31081,536031,https://letterboxd.com/film/a-quiet-place-day-one/
MaXXXine,2024,Ti West,"['Mia Goth', 'Elizabeth Debicki', 'Moses Sumney', 'Michelle Monaghan', 'Bobby Cannavale', 'Halsey', 'Lily Collins', 'Giancarlo Esposito', 'Kevin Bacon', 'Charley Rowan McCain', 'Simon Prast', 'Deborah Geffner', 'Daniel Lench', 'Chloe Farnworth', 'Brad Swanick', 'Uli Latukefu', 'Susan Pingleton', 'Zachary Mooren', 'Ned Vaughn', 'Marcus LaVoi', 'Sophie Thatcher', 'Albert Kong', 'Toby Huss', 'Taylor Kowalski', 'Pegah Rashti', 'Larry Fessenden', 'Marlyn Ortiz', 'Alison Wonderland', 'Kristin Carey', 'Cecilia Yesuil Kim', 'Clayton Farris', 'Melissa Kaye Bontempt', 'Allen Waiserman']",3.11,4.0,"['Thriller', 'Horror', 'Mystery']",104,['USA'],English,['English'],"In 1980s Hollywood, adult film star and aspiring actress Maxine Minx finally gets her big break. But as a mysterious killer stalks the starlets of Hollywood, a trail of blood threatens to reveal her sinister past.","['A24', 'Motel Mojave', 'Access Entertainment']",580648,129290,152483,1700,2406,7627,10718,43469,64807,135335,102437,88026,21119,33406,509350,https://letterboxd.com/film/maxxxine/
Inside Out 2,2024,Kelsey Mann,"['Amy Poehler', 'Maya Hawke', 'Kensington Tallman', 'Liza Lapira', 'Tony Hale', 'Lewis Black', 'Phyllis Smith', 'Ayo Edebiri', 'Lilimar', 'Grace Lu', 'Sumayyah Nuriddin-Green', 'Adèle Exarchopoulos', 'Diane Lane', 'Kyle MacLachlan', 'Paul Walter Hauser', 'Yvette Nicole Brown', 'Ron Funches', 'James Austin Johnson', 'Yong Yea', 'Steve Purcell', 'Dave Goelz', 'Kirk R. Thatcher', 'Frank Oz', 'Paula Pell', 'June Squibb', 'Pete Docter', 'Paula Poundstone', 'John Ratzenberger', 'Sarayu Blue', 'Flea', 'Bobby Moynihan', 'Kendall Coyne Schofield']",3.65,4.0,"['Comedy', 'Drama', 'Animation', 'Adventure', 'Family']",97,['USA'],English,['English'],"Teenager Riley's mind headquarters is undergoing a sudden demolition to make room for something entirely unexpected: new Emotions! Joy, Sadness, Anger, Fear and Disgust, who’ve long been running a successful operation by all accounts, aren’t sure how to feel when Anxiety shows up. And it looks like she’s not alone.","['Walt Disney Pictures', 'Pixar']",1741434,196268,532649,2100,2374,6480,6720,38384,60986,252034,304897,470033,139237,209753,1490898,https://letterboxd.com/film/inside-out-2-2024/
The Substance,2024,Coralie Fargeat,"['Demi Moore', 'Margaret Qualley', 'Dennis Quaid', 'Edward Hamilton-Clark', 'Gore Abrams', 'Oscar Lesage', 'Christian Erickson', 'Robin Greer', 'Tom Morton', 'Hugo Diego Garcia', 'Daniel Knight', 'Jonathon Carley', 'Jiselle Henderkott', 'Akil Wingate', 'Vincent Colombe', 'Billy Bentley', 'Lennard Ridsdale', 'Jordan Ford Silver', 'Oscar Salem', 'Viviane Bossina', 'Matthew Luret', 'Jana Bittnerová', 'Olivier Raynal', 'Tiffany Hofstetter', 'Nicolas Royer', 'Nathan Rippy', 'Manon Arizmendi', 'Virginie Kotlinski', 'Brett Gillen', 'Charlotte Marquardt', 'Léa Hengl', 'Gaëlle Raymond', 'Claire Lemaire', 'Lila Boughoufala', 'Aurélien Lorgnier', 'Ivan Sellier', 'Philip Schurer', 'Christian Bourmier', 'Martin Graham', 'Christian Bordeleau', 'Patrick Hamel', ""Didier D'Hondt"", 'Jacques-Yves Dorges', 'Jean-Claude Matthey', 'Olivier Jarcin', 'Jean-Luc Magneron', 'Charlotte Murray', 'Aaron Kahn', 'Gabriela Arnon', 'Nancy Josephson Lahoussine', 'Andrew Eldridge', 'Denise Powers', 'Bryan Jones', 'Adam Carage', 'Maria McClurg', 'Andrew Desmond', 'Rebecca Lafont', 'Laura Puech', 'Ryan Chidester', 'Céline Vogt', 'Yannick Guérin', 'Jean Miel', 'Paul Descoings', 'Benoit Lévêque', 'Arthur Molinet', 'Manon Sachot', 'Bastien Jorelle', 'Kelly Hoarau', 'Michel Juskiewicz', 'Louise Greggory', 'Christophe Sartirano', 'Florent Torres', 'Romain Caldeira', 'Barthelemy Thomas', 'Axel Baille', 'Ashley Lambert', 'Ranjani Brow', 'Chase Fein', 'Shane Sweet', 'William Calvert', 'Michael Corbett', 'Stephen Apostolina', 'Yann Bean', 'Audrey Alcide', 'Jonathan Jenvrin', 'Mimi Maury', 'Amelye Solange', 'Kévin Table', 'Laura Boera', 'Cissy Duc', 'Sophie Mercier', 'Marie Valton', 'Katrina Budzynski', 'Alicia Maury', 'Megane Adamik', 'Annalisa Pagnotta', 'Maelle Dantigny', 'Aleksandra Fontaine Kedzierska', 'Pauline Sagetat', 'Agustina Fitzsimons', 'Elena Shcheglova', 'Eve Marchant', 'Lola Donati', 'Kate Matthews', 'Ophélie Jonard', 'Pauline Richard', 'Laureen Cappelliez', 'Daria Panchenko', 'Delphine Beaulieu', 'Victoria Brun', 'Cara Chapman', 'Katharine Matthews', 'Alexandra Faget', 'Clémence Juville', ""Margot L'Entete"", 'Hillary Sukhonos', 'Matthew Géczy', 'Namory Bakayoko', 'Gregory Defleur']",3.91,4.0,"['Horror', 'Drama', 'Science Fiction']",141,"['France', 'UK']",English,['English'],"A fading celebrity decides to use a black market drug, a cell-replicating substance that temporarily creates a younger, better version of herself.","['Working Title Films', 'Blacksmith']",1091134,182921,405096,11000,6517,10037,8283,26943,30868,88412,126526,296182,175680,203364,972812,https://letterboxd.com/film/the-substance/
The Last Journey,2024,"Fredrik Wikingsson, Filip Hammar","['Filip Hammar', 'Lars Hammar', 'Fredrik Wikingsson', 'Tiina Hammar', 'Emelie Boursault-Atlan', 'David Socquet-Clerc', 'Carole Papini']",3.71,4.5,['Documentary'],90,['Sweden'],Swedish,"['Swedish', 'English', 'French']","Lars Hammar's retirement didn't go as planned. Instead of a new beginning with travels and experiences, Lars has turned more and more passive to his wife and son Filip's dismay. Filip gets an idea: to take his rugged old father on a journey to his beloved France and let him revisit his most beloved places. By recreating the same vacation the family used to do when Filip was a child, and secretly try and stage some wonderful moments, Filip hopes to reignite Lars' spark again. With the help of his best friend Fredrik, a large heap of optimism and creativity, and an old Renault 4, Filip takes his father on one last adventure.",['Nexiko'],2330,439,526,8,1,4,8,22,42,203,309,715,271,288,1863,https://letterboxd.com/film/the-last-journey-2024/
Dune: Part Two,2024,Denis Villeneuve,"['Timothée Chalamet', 'Zendaya', 'Rebecca Ferguson', 'Javier Bardem', 'Josh Brolin', 'Austin Butler', 'Florence Pugh', 'Dave Bautista', 'Christopher Walken', 'Léa Seydoux', 'Stellan Skarsgård', 'Charlotte Rampling', 'Souheila Yacoub', 'Roger Yuan', 'Babs Olusanmokun', 'Alison Halstead', 'Giusi Merli', 'Kait Tenison', 'Tara Breathnach', 'Akiko Hitomi', 'Imola Gáspár', 'Alison Adnet', 'Hamza Baissa', 'Hassan Najib', 'Jasper Ryan-Carter', 'Elbooz Omar Ahmed Fathie', 'Abdelkarim Hussein Seli Mohamed Hassanin', 'Joseph Beddelem', 'Xavier Alba Royo', 'Rachid Abbad', 'Affif Ben Badra', 'Botond Bóta', 'Abdelaziz Boumane', 'Abdellah Echahbi', 'Zouhair Elakkari', 'Noureddine Hajoujou', 'Mohamed Mouraoui', 'Adil Achraf Sayd', 'Hamza Sayd', 'Hopi Grace', 'Havin Fathi', 'Kincsö Pethö', 'Cat Simmons', 'Burt Caesar', 'Remi Fadare', 'Amer El-Erwadi', 'Tedroy Newell', 'Oxa Hazel', 'Hajiyeva Pakiza', 'Leon Herbert', 'Sima Rostami', 'Yvonne Campbell', 'Joseph Charles', 'Vic Zander', 'Dylan Baldwin', 'Marcia Tucker', 'Nicola Brome', 'Kathy Owen', 'Huw Novelli', 'Moe Bar-El', 'Serhat Metin', 'Amra Mallassi', 'Adam Bloom', 'Luis Alkmim', 'Jordan Long', 'Omar A.K.', 'Zdeněk Dvořáček', 'Billy Clements', 'Anton Valensi', 'Lex Daniel', 'Dominic McHale', 'Paul Boyle', 'Niall White', 'Tony Cook', 'Gábor Szemán', 'Jonathan Gunning', 'Will Irvine', 'Alan Mehdizadeh', 'Rex Adams', 'Molly Mcowan', 'Ana Cilas', 'Kajsa Mohammar', 'Sára Bácsfalvi', 'Zsófia Kocsis', 'Matthew Sim', 'Steve Wall', 'Italo Amerighi', 'Tim Hilborne', 'Cecile Sinclair', 'Tracy Coogan', 'Zoe Kata Kaska', 'Jimmy Walker', 'Rand Faris', 'Fouad Humaidan', 'Manaf Irani', 'Dora Kápolnai-Schvab', 'Joelle', 'Anya Taylor-Joy', 'Peter Sztojanov Jr.']",4.43,5.0,"['Adventure', 'Science Fiction']",167,['USA'],English,['English'],"Follow the mythic journey of Paul Atreides as he unites with Chani and the Fremen while on a path of revenge against the conspirators who destroyed his family. Facing a choice between the love of his life and the fate of the known universe, Paul endeavors to prevent a terrible future only he can foresee.",['Legendary Pictures'],2160725,353445,971702,55000,2425,4951,2962,15917,18863,80676,117454,395589,414822,794251,1847910,https://letterboxd.com/film/dune-part-two/
A Heart Is Always Red,2024,"Anders ""Balsam"" Hellström","['Joakim Thåström', 'Per Hägglund', 'Christian Falk', 'Fred Asp', 'Stry Terrarie', 'Gunnar Ljungstedt', 'Lennart Eriksson', 'Tove Falk Olsson', 'Jeff Eyrich', 'Arild Skrindo', 'Pierre Schori', 'Olof Palme', 'Maria Antonia Garcia Diaz', 'Magda Brättemark', 'Salvador Espinosa']",3.56,3.5,"['Music', 'Documentary']",103,['Sweden'],Swedish,"['Swedish', 'English', 'Norwegian', 'Spanish']","Born from the ashes of the iconic punk band Ebba Grön, this documentary tells the story of Imperiet and their journey to become the leading star of the post-punk generation and one of Sweden's biggest rock bands. It's also the story of Sweden, at a time in which they took their firm position on the world stage and when political commitment from the artists was a necessity.","['Docster', 'SVT', 'Film Stockholm', 'Gotlands Filmfond', 'Amarcord']",664,89,147,2,1,2,1,17,25,114,116,152,33,33,494,https://letterboxd.com/film/a-heart-is-always-red/
The Remarkable Life of Ibelin,2024,Benjamin Ree,"['Mats Steen', 'Kelsey Ellison', 'Zoe Croft', 'Paul Wild', 'Elena Pitsiaeli', 'Ed Larkin']",4.09,4.0,"['Documentary', 'Animation']",103,['Norway'],Norwegian,"['Norwegian', 'Danish', 'English']",The secret life of a young World of Warcraft gamer is vividly reimagined when his online friends contact his family after his death.,"['Medieoperatørene', 'VGTV']",15576,4246,5431,53,4,12,16,85,154,845,1690,4197,2301,3135,12439,https://letterboxd.com/film/the-remarkable-life-of-ibelin/
Godzilla Minus One,2023,Takashi Yamazaki,"['Ryunosuke Kamiki', 'Minami Hamabe', 'Yuki Yamada', 'Munetaka Aoki', 'Hidetaka Yoshioka', 'Sakura Ando', 'Kuranosuke Sasaki', 'Saki Nakatani', 'Mio Tanaka', 'Yuya Endo', 'Kisuke Iida', 'Kenji Anan', 'Kenji Mizuhashi', 'Kunihiro Suda', 'Shota Taniguchi', 'Akio Nakadai', 'Ippei Sasaki', 'Ozuno Nakamura', 'Masaichi Wanibuchi', 'Sho Nishigaki', 'Fuma Sasaki', 'Tsutomu Osabe', 'Yuji Komatsu', 'Yosuke Minokawa', 'Sentarou Kusakabe', 'Kota Kawabata', 'Genki Furugen', 'Yuto Yoshikawa', 'Yuya Oshima', 'Hirotaka Akatsuma', 'Ryo Hamanaka', 'Kiyomi Aratani', 'Yukio Tsukamoto', 'Shoji Omiya', 'Michael Arias', 'Masataka Matsubara', 'Kentaro Furuyama', 'Takumi Matsui', 'Tetsu Hirahara', 'Hiroyuki Toritani', 'Seitaro Chiba', 'Tatsuki Oguma', 'Hidemasa Mase', 'Jun Ohnishi', 'Yuho Mochinaga', 'Daiki Ichikawa', 'Yasunori Ota', 'Ryota Tsuchihashi', 'Atsushi Saitou', 'Masayuki Yamada', 'Goro Sato', 'Keisuke Fujita', 'Yuta Wakabayashi', 'Koya Fukuda', 'Shunpeter Sugisaki', 'Yuki Takao', 'Yusuke Karita', 'Makoto Matsumoto', 'Shinji Nagashima', 'Akihiro Yamamoto', 'Hidehiko Yamada', 'Atomu Ito', 'Django Yamada', 'Gomez Hori', 'Shohei Abe', 'Gen Shimada', 'Masatoshi Kihara', 'Masaru Yahagi', 'Touta Tawaragi', 'Etsuji Harada', 'Senji Nakagi', 'Tetsunori Akira', 'Mao Ohno', 'Ami Kitamikado', 'Yoka', 'Mami Tokuda', 'Yukihide Ueda', 'Sho Tsuruta', 'Makoto Araki', 'Yamato Aizawa', 'Mizuki Hasegawa', 'Kisuke Inoue', 'Miki Mirai', 'Daichi Abe', 'Rikako Miura', 'Gohshuu', 'Yuko Onose', 'Seiji Okuda', 'Eisuke Sasai', 'Shinsuke Kasai', 'Saori', 'Takato Yonemoto', 'Yoshiyo Naka', 'Ikumu Shigeta', 'Keita Chiba', 'Masato Nakano', 'Kiyoshi Uchida', 'Aya Sakura', 'Ayane Kamoi', 'Risa Miyake', 'Mami Aoki']",4.07,4.0,"['Horror', 'Science Fiction', 'Action']",124,['Japan'],Japanese,"['Japanese', 'English']","In postwar Japan, Godzilla brings new devastation to an already scorched landscape. With no military intervention or government help in sight, the survivors must join together in the face of despair and fight back against an unrelenting horror.","['TOHO', 'TOHO Studios', 'Robot Communications']",699734,165820,294362,8200,805,2031,1874,7980,11781,45066,79567,193697,129836,138143,610780,https://letterboxd.com/film/godzilla-minus-one/
Saw X,2023,Kevin Greutert,"['Tobin Bell', 'Shawnee Smith', 'Synnøve Macody Lund', 'Steven Brand', 'Renata Vaca', 'Joshua Okamoto', 'Octavio Hinojosa Martínez', 'Paulette Hernández', 'Jorge Briseño', 'Michael Beach', 'Costas Mandylor', 'Isan Beomhyun Lee', 'David Alfano', 'Katie Barberi', 'Lucía Gómez-Robledo', 'Donagh Gordon', 'Sebastián Torres', 'Cristo Ruiz', 'Baltimore Beltrán', 'Kerry Ardra', 'Natasha Goss', 'Craig Hurley', 'James Burg', 'Bailey Guidry']",3.23,2.5,"['Thriller', 'Horror']",118,['USA'],English,"['English', 'Spanish']","Between the events of 'Saw' and 'Saw II', a sick and desperate John Kramer travels to Mexico for a risky and experimental medical procedure in hopes of a miracle cure for his cancer, only to discover the entire operation is a scam to defraud the most vulnerable. Armed with a newfound purpose, the infamous serial killer returns to his work, turning the tables on the con artists in his signature visceral way through devious, deranged, and ingenious traps.","['Twisted Pictures', 'Lionsgate']",375558,91770,98524,1100,2867,6226,6449,20689,27224,70483,66404,67448,17370,26046,311206,https://letterboxd.com/film/saw-x/
The Creator,2023,Gareth Edwards,"['John David Washington', 'Madeleine Yuna Voyles', 'Gemma Chan', 'Allison Janney', 'Ken Watanabe', 'Sturgill Simpson', 'Amar Chadha-Patel', 'Marc Menchaca', 'Robbie Tann', 'Ralph Ineson', 'Michael Esper', 'Veronica Ngo', 'Ian Verdun', 'Daniel Ray Rodriguez', 'Rad Pereira', 'Syd Skidmore', 'Karen Aldridge', 'Teerawat Mulvilai', 'Leanna Chea', 'Sahatchai Chumrum', 'Apiwantana Duenkhao', 'Mariam Khummaung', 'Natthaphong Chaiyawong', 'Tawee Teesura', 'Kulsiri Thongrung', 'Charlie McElveen', 'Chananticha Chaipa', 'Sawanee Utoomma', 'Monthatip Suksopha', 'Brett Bartholomew', 'Jeb Kreager', 'Mackenzie Lansing', 'Stephen Howard Thomas', 'Agneta Catarina Békassy de Békas', 'Brett Parks', 'Phaithoon Wanglomklang', 'Ron Weaver', 'Mav Kang', 'John Garrett Mahlmeister', 'Scott Thomas', 'Kandanai Chotikapracal', 'Niko Rusakov', 'James David Henry', ""Eoin O'Brien"", 'Dana Blouin', 'Anjana Ghogar', 'Pongsanart Vinsiri', 'Molywon Phantarak', 'Chalee Sankhavesa', 'Pat Skelton', 'Elliot Berk', 'Art Ybarra']",3.27,3.5,"['Action', 'Science Fiction', 'Adventure']",134,"['Canada', 'USA']",English,"['English', 'Japanese', 'Thai', 'Vietnamese']","Amid a future war between the human race and the forces of artificial intelligence, a hardened ex-special forces agent grieving the disappearance of his wife, is recruited to hunt down and kill the Creator, the elusive architect of advanced AI who has developed a mysterious weapon with the power to end the war—and mankind itself.","['New Regency Pictures', 'Entertainment One', 'Regency Enterprises', 'Bad Dreams Productions']",422602,90054,101993,778,1454,4269,5701,22708,36330,88991,88040,76099,19476,18277,361345,https://letterboxd.com/film/the-creator-2023/
Poor Things,2023,Yorgos Lanthimos,"['Emma Stone', 'Mark Ruffalo', 'Willem Dafoe', 'Ramy Youssef', 'Christopher Abbott', 'Suzy Bemba', 'Jerrod Carmichael', 'Kathryn Hunter', 'Vicki Pepperdine', 'Hanna Schygulla', 'Margaret Qualley', 'Jack Barton', 'Charlie Hiscock', 'Attila Dobai', 'Emma Hindle', 'Anders Grundberg', 'Attila Kecskeméthy', 'Jucimar Barbosa', 'Carminho', 'Angela Paula Stander', 'Gustavo Gomes', 'Kate Handford', 'Owen Good', 'Zen Joshua Poisson', 'Vivienne Soan', 'Jerskin Fendrix', 'István Göz', 'Bruna Asdorian', 'Tamás Szabó Sipos', 'Tom Stourton', 'Mascuud Dahir', 'Miles Jovian', 'Jeremy Wheeler', 'János Geréb', 'Patrick de Valette', 'Raphaël Thiéry', 'Boris Gillot', 'Dorina Kovács', 'Yorgos Stefanakos', 'Hubert Benhamdine', 'Laurent Borel', 'Gábor Patay', 'Laurent Winkler', 'Andrew Hefler', 'Damien Bonnard', 'Noah Breton', 'Donovan Fouassier', 'Wayne Brett', 'John Locke', 'Keeley Forsyth', 'David Bromley', 'Celina Schleicher', 'Roderick Hill']",4.01,4.5,"['Romance', 'Science Fiction', 'Comedy']",142,"['Ireland', 'UK', 'USA']",English,"['English', 'French', 'Portuguese']","Brought back to life by an unorthodox scientist, a young woman runs off with a lawyer on a whirlwind adventure across the continents. Free from the prejudices of her times, she grows steadfast in her purpose to stand for equality and liberation.","['Searchlight Pictures', 'Film4 Productions', 'TSG Entertainment', 'Element Pictures', 'Limp', 'Fruit Tree']",2054269,369515,784379,24000,14062,21460,13012,47989,45961,144592,183661,485523,342439,449864,1748563,https://letterboxd.com/film/poor-things-2023/
Teenage Mutant Ninja Turtles: Mutant Mayhem,2023,Jeff Rowe,"['Micah Abbey', 'Shamon Brown Jr.', 'Nicolas Cantu', 'Brady Noon', 'Ayo Edebiri', 'Maya Rudolph', 'John Cena', 'Seth Rogen', 'Rose Byrne', 'Natasia Demetriou', 'Giancarlo Esposito', 'Jackie Chan', 'Ice Cube', 'Paul Rudd', 'Post Malone', 'Hannibal Buress', 'Jimmy Donaldson', 'Derek Wilson', 'Lukas Williams', 'Michael Badalucco', 'Dempsey Pappion', 'John Capodice', 'Andia Winslow', 'Raechel Wong', 'David Faustino', 'Danny Mastrogiorgio', 'Noel Gibson', 'Myra Owyang', 'Kevin Eastman', 'Alex Hirsch', 'Mike Rianda', 'Bobby Wagner', 'Greg Levitan', 'Illya Quinteros', 'Natalie Canizares', 'Kyler Spears', 'Jeff Rowe']",3.77,3.0,"['Action', 'Comedy', 'Animation', 'Science Fiction']",100,"['Canada', 'France', 'USA']",English,"['English', 'Chinese']","After years of being sheltered from the human world, the Turtle brothers set out to win the hearts of New Yorkers and be accepted as normal teenagers through heroic acts. Their new friend April O'Neil helps them take on a mysterious crime syndicate, but they soon get in over their heads when an army of mutants is unleashed upon them.","['Paramount Pictures', 'Nickelodeon Movies', 'Point Grey Pictures', 'Cinesite Animation', 'Mikros Animation']",473196,114453,183967,1400,664,1389,1657,6479,11339,48183,89921,144701,47239,47941,399513,https://letterboxd.com/film/teenage-mutant-ninja-turtles-mutant-mayhem/
Oppenheimer,2023,Christopher Nolan,"['Cillian Murphy', 'Emily Blunt', 'Matt Damon', 'Robert Downey Jr.', 'Florence Pugh', 'Josh Hartnett', 'Casey Affleck', 'Rami Malek', 'Kenneth Branagh', 'Benny Safdie', 'Jason Clarke', 'Dylan Arnold', 'Tom Conti', ""James D'Arcy"", 'David Dastmalchian', 'Dane DeHaan', 'Alden Ehrenreich', 'Tony Goldwyn', 'Jefferson Hall', 'David Krumholtz', 'Matthew Modine', 'Scott Grimes', 'Kurt Koehler', 'John Gowans', 'Macon Blair', 'Harry Groener', 'Gregory Jbara', 'Ted King', 'Tim DeKay', 'Steven Houska', 'Petrie Willink', 'Matthias Schweighöfer', 'Alex Wolff', 'Josh Zuckerman', 'Rory Keane', 'Michael Angarano', 'Emma Dumont', 'Sadie Stratton', 'Britt Kyle', 'Guy Burnet', 'Tom Jenkins', 'Louise Lombard', 'Michael Andrew Baker', 'Jeff Hephner', 'Olli Haaskivi', 'David Rysdahl', 'Josh Peck', 'Jack Quaid', 'Brett DelBuono', 'Gustaf Skarsgård', 'James Urbaniak', 'Trond Fausa Aurvåg', 'Devon Bostick', 'Danny Deferrari', 'Christopher Denham', 'Jessica Erin Martin', 'Ronald Auguste', 'Máté Haumann', 'Olivia Thirlby', 'Jack Cutmore-Scott', 'Harrison Gilbertson', 'James Remar', 'Will Roberts', 'Pat Skipper', 'Steve Coulter', 'Jeremy John Wells', 'Sean Avery', 'Adam Kroeger', 'Drew Kenney', 'Bryce Johnson', 'Flora Nolan', 'Kerry Westcott', 'Christina Hogue', 'Clay Bunker', 'Tyler Beardsley', 'Maria Teresa Zuppetta', 'Kate French', 'Gary Oldman', 'Hap Lawrence', 'Meg Schimelpfenig']",4.21,4.5,"['History', 'Drama']",181,"['UK', 'USA']",English,"['English', 'Dutch']",The story of J. Robert Oppenheimer's role in the development of the atomic bomb during World War II.,"['Syncopy', 'Universal Pictures', 'Atlas Entertainment', 'Breakheart Films', 'Peters Creek Entertainment']",3062920,512918,1207777,34000,5565,12758,7171,43395,41343,194571,223339,668372,508563,793643,2498720,https://letterboxd.com/film/oppenheimer-2023/
