Film_title,Release_year,Director,Cast,Average_rating,Owner_rating,Genres,Runtime,Countries,Original_language,Spoken_languages,Description,Studios,Watches,List_appearances,Likes,Fans,½,★,★½,★★,★★½,★★★,★★★½,★★★★,★★★★½,★★★★★,Total_ratings,Film_URL
Harry Potter and the Prisoner of Azkaban,2004,Alfonso Cuarón,"['Daniel Radcliffe', 'Rupert Grint', 'Emma Watson', 'Robbie Coltrane', 'Michael Gambon', 'Gary Oldman', 'David Thewlis', 'Timothy Spall', 'Alan Rickman', 'Tom Felton', 'Emma Thompson', 'Julie Walters', 'Richard Griffiths', 'Fiona Shaw', 'Maggie Smith', 'David Bradley', 'Pam Ferris', 'Dawn French', 'Julie Christie', 'Robert Hardy', 'Mark Williams', 'Harry Melling', 'Adrian Rawlins', 'Geraldine Somerville', 'Lee Ingleby', 'Lenny Henry', 'Jimmy Gardner', 'Jim Tavaré', 'Abby Ford', 'Oliver Phelps', 'James Phelps', 'Chris Rankin', 'Bonnie Wright', 'Devon Murray', 'Warwick Davis', 'Matthew Lewis', 'Sitara Shah', 'Jennifer Smith', 'Bronson Webb', 'Josh Herdman', 'Genevieve Gaunt', 'Kandice Morris', 'Alfred Enoch', 'Annalisa Bugliani', 'Tess Bu Cuarón', 'Violet Columbus', 'Paul Whitehouse', 'Ekow Quartey', 'Ricky Sahota', 'Jamie Waylett', 'Sharon Sandhu', 'Danielle Tabor', 'Freddie Davies', 'Peter Best', 'Ian Brown', 'Marianne Chase', 'Tom Ackerley']",4.1,4.0,"['Fantasy', 'Adventure']",141,"['UK', 'USA']",English,['English'],"Year three at Hogwarts means new fun and challenges as Harry learns the delicate art of approaching a Hippogriff, transforming shape-shifting Boggarts into hilarity and even turning back time. But the term also brings danger: soul-sucking Dementors hover over the school, an ally of the accursed He-Who-Cannot-Be-Named lurks within the castle walls, and fearsome wizard Sirius Black escapes Azkaban. And Harry will confront them all.","['Warner Bros. Pictures', '1492 Pictures', 'Heyday Films', 'P of A Productions Limited']",2969096,253622,910261,33000,2732,6262,3124,22894,24227,164604,178928,488534,201980,484588,1577873,https://letterboxd.com/film/harry-potter-and-the-prisoner-of-azkaban/
The Day After Tomorrow,2004,Roland Emmerich,"['Dennis Quaid', 'Jake Gyllenhaal', 'Emmy Rossum', 'Dash Mihok', 'Jay O. Sanders', 'Sela Ward', 'Austin Nichols', 'Arjay Smith', 'Tamlyn Tomita', 'Sasha Roiz', 'Ian Holm', 'Richard McMillan', 'Nassim Sharara', 'Carl Alacchi', 'Kenneth Welsh', ""Michel 'Gish' Abou-Samah"", 'Kenneth Moskow', 'Glenn Plummer', 'Adrian Lester', 'Nestor Serrano', 'John Maclaren', 'Richard Zeman', 'Perry King', 'Mimi Kuzyk', 'Vitali Makarov', 'Russell Yuen', 'Tim Bagley', 'Chris Britton', 'Christian Tessier', 'Rick Hoffman', 'Alan Fawcett', 'Sheila McCarthy', 'Amy Sloan', 'Karen Glave', 'Joe Cobden', 'Caroline Keenan', 'Matt Adler', 'Nobuya Shimamoto', 'Robin Wilcock', 'Jesus Perez', 'Wendy L. Walsh']",2.94,3.0,"['Action', 'Thriller', 'Science Fiction', 'Adventure']",124,['USA'],English,"['English', 'Japanese', 'French', 'Arabic', 'Spanish']","After paleoclimatologist Jack Hall is largely ignored by UN officials when presenting his environmental concerns about the beginning of a new Ice Age, his research proves true when a superstorm develops, setting off catastrophic natural disasters throughout the world. Trying to get to his son, Sam, who is trapped in New York City with his friend Laura and others, Jack and his crew must travel to get to Sam before it's too late.","['20th Century Fox', 'Centropolis Entertainment', 'Lionsgate', 'The Mark Gordon Company']",550325,37298,61774,818,2295,8315,10011,36789,41849,83466,42475,32040,5308,10381,272929,https://letterboxd.com/film/the-day-after-tomorrow/
Shrek 2,2004,"Conrad Vernon, Kelly Asbury","['Mike Myers', 'Eddie Murphy', 'Cameron Diaz', 'Julie Andrews', 'Antonio Banderas', 'John Cleese', 'Rupert Everett', 'Jennifer Saunders', 'Aron Warner', 'Kelly Asbury', 'Cody Cameron', 'Conrad Vernon', 'Christopher Knights', 'David P. Smith', 'Mark Moseley', 'Kelly Cooney Cilella', 'Wendy Bilanski', 'Larry King', 'Guillaume Aretos', 'Chris Miller', 'Latifa Ouaou', 'Alina Phelan', 'Erika Thomas', 'Joan Rivers', 'Andrew Adamson']",4.06,4.0,"['Family', 'Adventure', 'Comedy', 'Romance', 'Animation', 'Fantasy']",92,['USA'],English,['English'],"Shrek, Fiona, and Donkey set off to Far, Far Away to meet Fiona's mother and father, the Queen and King. But not everyone is happily ever after. Shrek and the King find it difficult to get along, and there's tension in the marriage. The Fairy Godmother discovers that Fiona has married Shrek instead of her son Prince Charming and plots to destroy their marriage.","['DreamWorks Animation', 'Pacific Data Images']",2224133,163740,555796,25000,2190,6619,4693,29751,28006,139256,120946,276714,113124,385016,1106315,https://letterboxd.com/film/shrek-2/
Mean Girls,2004,Mark Waters,"['Lindsay Lohan', 'Rachel McAdams', 'Lizzy Caplan', 'Lacey Chabert', 'Amanda Seyfried', 'Daniel Franzese', 'Jonathan Bennett', 'Rajiv Surendra', 'Tina Fey', 'Tim Meadows', 'Ana Gasteyer', 'Neil Flynn', 'Amy Poehler', 'Dwayne Hill', 'Diego Klattenhoff', 'Molly Shanahan', 'Elana Shilling', 'Graham Kartna', 'Ely Henry', 'David Aherne', 'Ayo Agbonkpolo', 'Jonathan Malen', 'Jeff Moser', 'Miranda Edwards', 'Les Porter', 'Eve Crawford', 'Jack Newman', 'Michelyn Emelle', 'Bathsheba Garnett', 'Ky Pham', 'Danielle Nguyen', 'Daniel DeSanto', 'Alisha Morrison', 'Chris Anton', 'Jan Caruana', 'Wai Choy', 'Julia Chantrey', 'Jacky Chamberlain', 'Olympia Lukis', 'Stefanie Drummond', 'Kristen Bone', 'Jessie Wright', 'Tyson Fennell', 'Stephan Dickson', 'Andreja Punkris', 'Noelle Boggio', 'Jordan Dawe', 'Alexandra Stapley', 'Laura de Carteret', 'Nicole Crimi', 'Erin Norah Thompson', 'Dan Willmott', 'Michelle Hoffman', 'Valerie Casault', 'Sharron Matthews', 'Jo Chim', 'Randi Lee Butcher', 'Erin Jarvis', 'Kaylen Christensen', 'Jill Morrison', 'David Sazant', 'Clare Preuss', 'Bruce Hunter', 'Megan Millington', 'Tara Shelley', 'Shannon Todd', 'David Reale', 'Krysta Carter']",3.84,3.5,"['Comedy', 'Drama']",97,['USA'],English,"['English', 'Swahili', 'German', 'Vietnamese']","Cady Heron is a hit with The Plastics, the A-list girl clique at her new school, until she makes the mistake of falling for Aaron Samuels, the ex-boyfriend of alpha Plastic Regina George.","['Broadway Video', 'Paramount Pictures', 'M.G. Films']",2820694,228635,876121,23000,2858,8258,6718,40624,45755,247247,231730,497994,127517,422629,1631330,https://letterboxd.com/film/mean-girls/
Shaun of the Dead,2004,Edgar Wright,"['Simon Pegg', 'Nick Frost', 'Kate Ashfield', 'Lucy Davis', 'Dylan Moran', 'Penelope Wilton', 'Bill Nighy', 'Peter Serafinowicz', 'Jessica Hynes', 'Rafe Spall', 'Martin Freeman', 'Matt Lucas', 'Reece Shearsmith', 'Tamsin Greig', 'Julia Deakin', 'Steve Emerson', 'Nicola Cunningham', 'Arvind Doshi', 'Stuart Powell', 'Phyllis MacMahon', 'Patricia Franklin', 'Mark Donovan', 'Chris Martin', 'Jon Buckland', 'Vernon Kay', 'Trisha Goddard', 'Jeremy Thompson', 'Carol Barnes', 'Krishnan Guru-Murthy', 'Rob Butler', 'Keir Mills', 'Matt Jaynes', 'Gavin Ferguson', 'Horton Jupiter', 'Tim Baggaley', 'Finola Geraghty', 'Sonnell Dadral', 'Samantha Day', 'David Park', 'Robert Fitch', 'Sharon Gavin', 'Patch Connolly', 'Christopher Harwood', 'Nick Ewans', 'Alex Lutes', 'Keith Chegwin', 'Lucy Akhurst', 'Joe Cornish', 'Garth Jennings', 'Paul Kaye', 'Lauren Laverne', 'Michael Smiley', 'Paul Putner', 'Antonia Campbell-Hughes', 'Rob Brydon', 'Julia Davis', 'Mark Gatiss', 'Robert Popper', 'David Walliams', 'Peter Baynham', 'Edgar Wright', 'Nicholas Wilson', 'Kevin Wilson']",3.97,3.5,"['Comedy', 'Horror']",99,['UK'],English,['English'],"Shaun lives a supremely uneventful life, which revolves around his girlfriend, his mother, and, above all, his local pub. This gentle routine is threatened when the dead return to life and make strenuous attempts to snack on ordinary Londoners.","['WT² Productions', 'Big Talk Studios']",1310514,198229,426048,12000,1438,3853,3006,14804,18504,90737,127346,284651,119517,157426,821282,https://letterboxd.com/film/shaun-of-the-dead/
Eternal Sunshine of the Spotless Mind,2004,Michel Gondry,"['Jim Carrey', 'Kate Winslet', 'Kirsten Dunst', 'Mark Ruffalo', 'Elijah Wood', 'Tom Wilkinson', 'Jane Adams', 'David Cross', ""Deirdre O'Connell"", 'Thomas Jay Ryan', 'Ryan Whitney', 'Lola Daehler', 'Debbon Ayer', 'Gerry Robert Byrne', 'Brian Price', 'Josh Flitter', 'Paulie Litt', 'Amir Ali Said', 'Lauren Adler']",4.25,4.5,"['Science Fiction', 'Romance', 'Drama']",108,['USA'],English,['English'],"Joel Barish, heartbroken that his girlfriend underwent a procedure to erase him from her memory, decides to do the same. However, as he watches his memories of her fade away, he realises that he still loves her, and may be too late to correct his mistake.","['Focus Features', 'Anonymous Content', 'This is that']",2728685,415400,1188702,128000,2729,8132,4439,28617,24348,141486,159095,514970,299348,693804,1876968,https://letterboxd.com/film/eternal-sunshine-of-the-spotless-mind/
The Lord of the Rings: The Return of the King,2003,Peter Jackson,"['Elijah Wood', 'Ian McKellen', 'Viggo Mortensen', 'Sean Astin', 'Andy Serkis', 'Dominic Monaghan', 'Billy Boyd', 'John Noble', 'David Wenham', 'Miranda Otto', 'Bernard Hill', 'John Rhys-Davies', 'Orlando Bloom', 'Hugo Weaving', 'Liv Tyler', 'Cate Blanchett', 'Karl Urban', 'Ian Holm', 'Sean Bean', 'Lawrence Makoare', 'Marton Csokas', 'Paul Norell', 'Noel Appleby', 'Sarah McLeod', 'Ali Astin', 'Maisy McLeod-Riera', 'David Aston', 'John Bach', 'Sadwyn Brophy', 'Alistair Browning', 'Richard Edge', 'Jason Fitch', 'Bruce Hopkins', 'Ian Hughes', 'Bret McKenzie', 'Bruce Phillips', 'Shane Rangi', 'Todd Rippon', 'Thomas Robins', 'Harry Sinclair', 'Peter Tait', 'Joel Tobeck', 'Stephen Ure', 'Sala Baker', 'Robert Pollock', 'Ross Duncan', 'Pete Smith', 'Jed Brophy', 'Lee Hartley', 'Billy Jackson', 'Katie Jackson', 'Alan Howard', 'Jane Abbott', 'Gino Acevedo', 'Aidan Bell', 'Jarl Benzon', 'Jørn Benzon', 'Emma Deakin', 'Michael Elsworth', 'Clint Elvy', 'Zo Hartley', 'Peter Jackson', 'Sandro Kopp', 'Andrew Lesnie', 'Joseph Mika-Hunt', 'Henry Mortensen', 'Craig Parker', 'Rick Porras', 'Christian Rivers', 'Michael Semanick', 'Howard Shore', 'John Stephenson', 'Richard Taylor', 'Royd Tolkien', 'Brad Dourif', 'Christopher Lee']",4.51,5.0,"['Fantasy', 'Adventure', 'Action']",201,"['New Zealand', 'USA']",English,['English'],"As armies mass for a final battle that will decide the fate of the world--and powerful, ancient forces of Light and Dark compete to determine the outcome--one member of the Fellowship of the Ring is revealed as the noble heir to the throne of the Kings of Men. Yet, the sole hope for triumph over evil lies with a brave hobbit, Frodo, who, accompanied by his loyal friend Sam and the hideous, wretched Gollum, ventures deep into the very dark heart of Mordor on his seemingly impossible quest to destroy the Ring of Power.​","['New Line Cinema', 'WingNut Films', 'The Saul Zaentz Company']",2175353,273106,757363,61000,1821,4932,1783,13289,10058,68107,64524,249567,193109,667697,1274887,https://letterboxd.com/film/the-lord-of-the-rings-the-return-of-the-king/
Slim Susie,2003,Ulf Malmros,"['Tuva Novotny', 'Jonas Rimeika', 'Björn A. Ling', 'Kjell Bergqvist', 'Lotta Tejle', 'Malin Morgan', 'Michael Nyqvist', 'Lena Dahlman', 'Johan Östling', 'Anders Blomberg', 'Nicky Horn', 'Bengt Alsterlind', 'Papa Dee']",3.58,4.5,['Comedy'],97,['Sweden'],Swedish,"['Swedish', 'English']","When Erik, a Stockholm urbanite, learns that his beauty-queen sister, Susie, is missing, he goes to their country roots to look for her. But after talking to the eccentric locals -- including a shy video store clerk and a corrupt police officer -- Erik finds a woman who is not at all like the girl he left behind. Award-winning director Ulf Malmros helms this black comedy infused with hipster flair.","['MTV Produktion', 'Svenska Filminstitutet', 'Film i Väst', 'GötaFilm', 'Sandrew Metronome Sverige']",4121,826,745,71,12,38,22,134,152,547,547,792,222,294,2760,https://letterboxd.com/film/slim-susie/
Kill Bill: Vol. 1,2003,Quentin Tarantino,"['Uma Thurman', 'Lucy Liu', 'Vivica A. Fox', 'Daryl Hannah', 'David Carradine', 'Michael Madsen', 'Julie Dreyfus', 'Chiaki Kuriyama', 'Sonny Chiba', 'Gordon Liu Chia-hui', 'Michael Parks', 'Michael Bowen', 'Jun Kunimura', 'Kenji Ohba', 'Yuki Kazamatsuri', 'James Parks', 'Sakichi Sato', 'Jonathan Loughran', 'Yoshiyuki Morishita', 'Tetsuro Shimaguchi', 'Kazuki Kitamura', 'Yoji Tanaka', 'Issey Takahashi', 'Sō Yamanaka', 'Juri Manase', 'Akaji Maro', 'Goro Daimon', 'Shun Sugata', 'Zhang Jinzhan', 'Hu Xiaohui', 'Ambrosia Kelley', 'Sachiko Fujii', 'Yoshiko Yamaguchi', 'Ronnie Yoshiko Fujiyama', 'Shu Lan Tuan', 'Ai Maeda', 'Naomi Kusumi', 'Hikaru Midorikawa']",4.2,3.0,"['Crime', 'Action']",111,['USA'],English,"['English', 'Japanese', 'French']","An assassin is shot by her ruthless employer, Bill, and other members of their assassination circle – but she lives to plot her vengeance.","['Miramax', 'A Band Apart', 'Super Cool ManChu']",2660996,326072,1020821,51000,2537,7590,3935,25738,22515,141762,162322,532326,266200,539163,1704088,https://letterboxd.com/film/kill-bill-vol-1/
Love Actually,2003,Richard Curtis,"['Hugh Grant', 'Alan Rickman', 'Emma Thompson', 'Liam Neeson', 'Martine McCutcheon', 'Colin Firth', 'Bill Nighy', 'Laura Linney', 'Lúcia Moniz', 'Andrew Lincoln', 'Keira Knightley', 'Chiwetel Ejiofor', 'Gregor Fisher', 'Martin Freeman', 'Joanna Page', 'Heike Makatsch', 'Thomas Brodie-Sangster', 'Kris Marshall', 'Rodrigo Santoro', 'Abdul Salis', 'Rowan Atkinson', 'Rory MacGregor', 'Sienna Guillory', 'Billy Bob Thornton', 'Lulu Popplewell', 'Olivia Olson', 'Nina Sosanya', 'Frank Moorey', 'Jill Raymond', 'Tim Hatwell', 'Lynden David Hall', 'Jont Whittington', 'Dan Fredenburgh', 'Julia Davis', 'Alan Barnes', 'Shaughan Seymour', 'Helen Murton', 'Edward Hardwicke', 'Caroline John', 'Gemma Aston', 'Matt Harvey', 'Adrian Preater', 'Joanna Thaw', 'Junior Simpson', 'Brian Bovell', 'Sarah McDougall', 'Marcus Brigstocke', 'Richard Hawley', 'Wyllie Longmore', 'Gillian Barge', 'Richard Cotton', 'Kate Bowes Renna', 'Kate Glover', 'Nicola McRoy', 'Anthony McPartlin', 'Declan Donnelly', 'Elisabeth Margoni', 'Peter Marinker', 'Keir Charles', 'Doraly Rosen', 'Meg Wynn Owen', 'Carol Carey', 'Jo Whiley', 'Sarah Atkinson', 'Clare Bennett', 'Sarah Holland', 'Vicki Murdoch', 'Meredith Ostrom', 'Katherine Poulton', 'Tuuli Shipster', 'Michael Parkinson', 'Michael Fitzgerald', ""Ciaran O'Driscoll"", 'William Wadham', 'Catia Duarte', 'Igor Urdenko', 'Nat Udom', 'Ines Boughanmi', 'Yuk Sim Yau', 'John Sharian', 'Glenn Conroy', 'Ivana Miličević', 'January Jones', 'Elisha Cuthbert', 'Wes Butters', 'Laura Rees', 'Emma Buckley', 'Sheila Allen', 'Terry Reece', 'Colin Coull', 'Margery Mason', 'Katharine Bailey', 'Tiffany Boysell', 'Georgia Flint', 'Joanna Bacon', 'Bill Moody', 'Billy Campbell', 'Paul Slack', 'Adam Godley', 'Ruby Turner', 'Amanda Garwood', 'Arturo Venegas', 'Claudia Schiffer', 'Patrick Delaney', 'Helder Costa', 'Carla Vasconcelos', 'Stewart Howson', 'Jamie Edgell', 'Dave Fisher', 'Paul Heasman', 'Tony Lucken', 'Raul Atalaia', 'Nancy Sorrell', 'Shannon Elizabeth', 'Denise Richards', 'Richard Curtis', 'Frances de la Tour', 'Rebecca Frayn', 'Kelly Michelle Gray', 'Nia Jermin', 'Jeanne Moreau', 'Deanna Mustard', 'Anne Reid', 'Fiona Thompson']",3.46,3.0,"['Drama', 'Romance', 'Comedy']",135,"['France', 'UK', 'USA']",English,"['English', 'French', 'Portuguese']",Eight London couples try to deal with their relationships in different ways. Their tryst with love makes them discover how complicated relationships can be.,"['Working Title Films', 'DNA Films', 'Universal Pictures', 'StudioCanal']",1085704,129881,238385,6400,6605,14491,10539,38424,38765,118043,101013,143689,40636,92625,604830,https://letterboxd.com/film/love-actually/
Lost in Translation,2003,Sofia Coppola,"['Bill Murray', 'Scarlett Johansson', 'Akiko Takeshita', 'Kazuyoshi Minamimagoe', 'Kazuko Shibata', 'Take', 'Ryuichiro Baba', 'Akira Yamaguchi', 'Catherine Lambert', 'François du Bois', 'Tim Leffman', 'Gregory Pekar', 'Richard Allen', 'Giovanni Ribisi', 'Diamond Yukai', 'Jun Maki', 'Nao Asuka', 'Tetsuro Nakagawa', 'Kanako Nakazato', 'Fumihiro Hayashi', 'Hiroko Kawasaki', 'Daikon', 'Anna Faris', 'Asuka Shimuzu', 'Ikuko Takahashi', 'Koichi Tanaka', 'Hugo Codaro', 'Akiko Monou', 'Akimitsu Naruyama', 'Hiroshi Kawashima', 'Hiromix', 'Nobuhiko Kitamura', 'Nao Kitman', 'Akira', 'Kunichi Nomura', 'Yasuhiko Hattori', 'Shigekazu Aida', 'Kazuo Yamada', 'Akira Motomura', 'Osamu Shigematu', 'Takashi Fujii', 'Kei Takyo', 'Ryo Kondo', 'Yumi Ikeda', 'Yumika Saki', 'Yuji Okabe', 'Dietrich Bollmann', 'Georg O.P. Eschert', 'Mark Willms', 'Lisle Wilkerson', 'Blake Crawford', 'Angela Panetta', 'Nancy Steiner', 'Sam Arnold']",3.8,4.0,"['Drama', 'Romance']",102,"['UK', 'USA']",English,"['English', 'Japanese']","Two lost souls visiting Tokyo -- the young, neglected wife of a photographer and a washed-up movie star shooting a TV commercial -- find an odd solace and pensive freedom to be real in each other's company, away from their lives in America.","['American Zoetrope', 'Elemental Films']",1403157,225161,435882,32000,4924,12909,9483,39037,39418,132789,143785,275491,108716,169224,935776,https://letterboxd.com/film/lost-in-translation/
Spy Kids 3-D: Game Over,2003,Robert Rodriguez,"['Daryl Sabara', 'Ricardo Montalban', 'Alexa PenaVega', 'Sylvester Stallone', 'Courtney Jines', 'Ryan Pinkston', 'Robert Vito', 'Bobby Edner', 'Mike Judge', 'Salma Hayek Pinault', 'Elijah Wood', 'Emily Osment', 'Antonio Banderas', 'Holland Taylor', 'Carla Gugino', ""Matt O'Leary"", 'Cheech Marin', 'Danny Trejo', 'Alan Cumming', 'Tony Shalhoub', 'Steve Buscemi', 'Bill Paxton', 'George Clooney', 'Selena Gomez', 'Evan Sabara', 'Camille Chen', 'Steve Wertheimer', 'Alejandro Rose-Garcia', 'Lane Turney', 'Glen Powell', 'Bob Fonseca', 'Peter Marquardt', 'James Paxton']",2.44,2.5,"['Comedy', 'Science Fiction', 'Family', 'Action', 'Adventure']",84,['USA'],English,['English'],"Carmen's caught in a virtual reality game designed by the Kids' new nemesis, the Toymaker. It's up to Juni to save his sister, and ultimately the world.","['Dimension Films', 'Troublemaker Studios']",338068,22790,32427,305,5758,14354,12765,29175,19611,27302,10114,9566,1756,7735,138136,https://letterboxd.com/film/spy-kids-3-d-game-over/
Pirates of the Caribbean: The Curse of the Black Pearl,2003,Gore Verbinski,"['Johnny Depp', 'Orlando Bloom', 'Keira Knightley', 'Geoffrey Rush', 'Jack Davenport', 'Jonathan Pryce', 'Lee Arenberg', 'Mackenzie Crook', ""Damian O'Hare"", 'Giles New', 'Angus Barnett', 'David Bailie', 'Michael Berry Jr.', 'Isaac C. Singleton Jr.', 'Kevin McNally', 'Treva Etienne', 'Zoe Saldaña', 'Guy Siner', 'Ralph P. Martin', 'Paula J. Newman', 'Paul Keith', 'Dylan Smith', 'Lucinda Dryzek', 'Luke de Woolfson', 'Michael Sean Tighe', 'Greg Ellis', 'Dustin Seavey', 'Christian Martin', 'Israel Aduramo', 'Trevor Goddard', 'Vince Lozano', 'Ben Wilson', 'Antonio Valentino', 'Lauren Maher', 'Matthew Bowyer', 'Brye Cooper', 'Mike Babcock', 'Owen Finnegan', 'Ian McIntyre', 'Vanessa Branch', 'Sam Roberts', 'Ben Roberts', 'Martin Klebba', 'Félix Castro', 'Mike Haberecht', 'Rudolph McCollum', 'Gerard J. Reyes', 'M. Scott Shields', 'Christopher Sullivan', 'Craig Thomson', 'Fred Toft', 'D.P. FitzGerald', 'Jerry Gauny', 'Maxie J. Santillan Jr.', 'Michael Earl Lane', 'Tobias McKinney', 'David Patykewich', 'Tommy Schooler', 'Michael A. Thompson', 'Michael W. Williams', 'José Zelaya', 'Finneus Egan', 'Don LaDaga', 'LeJon Stewart', 'Christopher S. Capp', 'Gregory Ryan Alosio', 'Jordi Caballero', 'Tamara Castle', 'Paul Gagné', 'Joe Grisaffi', 'James McAuley']",3.94,3.5,"['Fantasy', 'Adventure', 'Action']",143,['USA'],English,['English'],"After Port Royal is attacked and pillaged by a mysterious pirate crew, capturing the governor's daughter Elizabeth Swann in the process, William Turner asks free-willing pirate Jack Sparrow to help him locate the crew's ship—The Black Pearl—so that he can rescue the woman he loves.","['Walt Disney Pictures', 'Jerry Bruckheimer Films']",2098890,155380,512513,10000,1335,5055,2976,21736,22791,140761,163405,372545,118109,202379,1051092,https://letterboxd.com/film/pirates-of-the-caribbean-the-curse-of-the-black-pearl/
Hulk,2003,Ang Lee,"['Eric Bana', 'Jennifer Connelly', 'Sam Elliott', 'Nick Nolte', 'Josh Lucas', 'Paul Kersey', 'Cara Buono', 'Todd Tesen', 'Kevin Rankin', 'Celia Weston', 'Mike Erwin', 'Lou Ferrigno', 'Stan Lee', 'Regi Davis', 'Craig Damon', 'Geoffrey Scott', 'Regina McKee Redwing', 'Daniel Dae Kim', 'Daniella Kuhn', 'Michael Kronenberg', 'David Kronenberg', 'Rhiannon Leigh Wryn', 'Lou Richards', 'Jennifer Gotzon', 'Louanne Kelley', 'Toni Kallen', 'Paul Kim Jr.', 'John Littlefield', 'Lorenzo Callender', 'Todd Lee Coralli', 'Johnny Kastl', 'Eric Ware', 'Jesse Corti', 'Rob Swanson', 'Mark Atteberry', 'Eva Burkley', 'Rondda Holeman', 'John A. Maraffi', 'Michael Papajohn', 'David St. Pierre', 'Boni Yanagisawa', 'David Sutherland', 'Sean Mahon', 'Brett Thacher', 'Kirk B.R. Woller', 'Randy Neville', 'John Prosky', 'Amir Faraj', 'Ricardo Aguilar', 'Victor Rivers', 'Lyndon Karp', 'Rick Avery', 'Thomas Rosales Jr.', 'Ang Lee', 'Ray Buffer', 'Andy Arness', 'Rory J. Aylward', 'Cougar Zank']",2.4,2.0,"['Science Fiction', 'Adventure', 'Action']",138,['USA'],English,"['English', 'Spanish']","Bruce Banner, a genetics researcher with a tragic past, suffers massive radiation exposure in his laboratory that causes him to transform into a raging green monster when he gets angry.","['Marvel Enterprises', 'Universal Pictures', 'Good Machine', 'Valhalla Motion Pictures']",377374,34317,26328,180,5809,16028,15062,41325,28940,36977,13318,10064,1707,3091,172321,https://letterboxd.com/film/hulk/
Finding Nemo,2003,Andrew Stanton,"['Albert Brooks', 'Ellen DeGeneres', 'Alexander Gould', 'Willem Dafoe', 'Geoffrey Rush', 'Brad Garrett', 'Allison Janney', 'Austin Pendleton', 'Stephen Root', 'Vicki Lewis', 'Joe Ranft', 'Andrew Stanton', 'Elizabeth Perkins', 'Nicholas Bird', 'Bob Peterson', 'Barry Humphries', 'Eric Bana', 'Bruce Spence', 'Bill Hunter', 'LuLu Ebeling', 'Jordan Ranft', 'Erica Beck', 'Erik Per Sullivan', 'John Ratzenberger', 'Carlos Alazraqui', 'Alec Medlock', 'Bob Bergen', 'Nicole Miller', 'Geoff Brooks', 'Lisa Peers', 'Paul Eiding', 'Phil Proctor', 'Leland Grossman', 'Daryl Sabara', 'Lili Ishida', 'Emmett Shoemaker', 'Oliver Kindred', 'Ben Stanton', 'Danny Mann', 'Kali Whitehurst', 'Rove McManus', 'James S. Baker', 'Vanessa Marano', 'Susan Blu', 'Annelise Nolting', 'Jeff Pidgeon', 'Jennifer Darling', 'Aaron Fors', 'Katherine Ringgold', 'Jess Harnell', 'David Ian Salter', 'Caroline Kindred', 'Sherry Lynn', 'Jim Ward', 'Mickie McGowan', 'Jack Angel', 'Laura Marano', 'Bobby Block', 'Laraine Newman', 'Jane Carr', 'Michaela Jill Murphy', 'Jan Rabson', 'Bradley Trevor Greive', 'Evan Sabara', 'Marc John Jefferies', 'Eliza Schneider', 'Lee Unkrich', 'Noah Luke']",4.04,4.0,"['Animation', 'Family']",100,['USA'],English,['English'],"Nemo, an adventurous young clownfish, is unexpectedly taken from his Great Barrier Reef home to a dentist's office aquarium. It's up to his worrisome father Marlin and a friendly but forgetful fish Dory to bring Nemo home -- meeting vegetarian sharks, surfer dude turtles, hypnotic jellyfish, hungry seagulls, and more along the way.",['Pixar'],2946243,205681,707213,6000,1449,4814,3128,24067,24978,176690,181652,495742,160655,343603,1416778,https://letterboxd.com/film/finding-nemo/
Evil,2003,Mikael Håfström,"['Andreas Wilson', 'Henrik Lundström', 'Gustaf Skarsgård', 'Linda Zilliacus', 'Jesper Salén', 'Mats Bergman', 'Johan Rabaeus', 'Marie Richardson', 'Lennart Hjulström', 'Björn Granath', 'Filip Berg', 'Ulf Friberg', 'Kjell Bergqvist', 'Fredrik af Trampe', 'Peter Eggers', 'Henrik Linnros', 'Sannamari Patjas', 'Magnus Roosmann']",3.76,4.0,['Drama'],113,"['Denmark', 'Sweden']",Swedish,['Swedish'],"Stockholm, in the 1950s. Erik is expelled from the local school for getting into one brawl too many. To protect Erik from his violent stepfather’s reaction to his expulsion, Erik's mother arranges for Erik to spend a year at Stjärnsberg Boarding School, the only school willing to accept him. This is Erik's last chance to graduate to Upper School and he promises his mother, for his and her sake, to do all he can to stay out of trouble.","['Moviola Film och Television AB', 'Skinworxxx', 'Nordisk Film Sweden']",16829,3868,3155,160,22,60,64,316,451,1826,2764,4145,1166,1074,11888,https://letterboxd.com/film/evil/
